{
  "name": "ensemble-ai",
  "version": "6.0.0",
  "description": "AI SDK skills for OpenAI, and other AI providers for Claude Code",
  "author": {
    "name": "Sunstone Partners",
    "email": "info@sunstonepartners.com",
    "url": "https://github.com/Sunstone-Partners"
  },
  "repository": "https://github.com/Sunstone-Partners/ensemble",
  "license": "MIT",
  "keywords": [
    "openai",
    "ai",
    "gpt",
    "llm",
    "embeddings",
    "agents",
    "ensemble"
  ],
  "commands": "./commands",
  "skills": "./skills"
}
