{
  "name": "ensemble-rails",
  "version": "6.0.0",
  "description": "Ruby on Rails backend framework skills",
  "author": {
    "name": "Sunstone Partners",
    "email": "info@sunstonepartners.com",
    "url": "https://github.com/Sunstone-Partners"
  },
  "repository": "https://github.com/Sunstone-Partners/ensemble",
  "license": "MIT",
  "keywords": [
    "rails",
    "ruby",
    "backend",
    "ensemble"
  ],
  "commands": "./commands",
  "skills": "./skills"
}
