{
  "name": "ensemble-agent-core",
  "version": "0.1.2",
  "description": "Shared, stage-agnostic run-index I/O primitives for the new-feature and fix-issue resumable workflows (npm library, no Claude Code skills/agents/commands)",
  "author": {
    "name": "Sunstone Partners",
    "email": "info@sunstonepartners.com",
    "url": "https://github.com/Sunstone-Partners"
  },
  "repository": "https://github.com/Sunstone-Partners/ensemble",
  "license": "MIT",
  "keywords": [
    "ensemble",
    "agent-core"
  ]
}
