{
  "name": "ensemble-git",
  "version": "5.3.2",
  "description": "Git workflow automation and conventional commits",
  "author": {
    "name": "Sunstone Partners",
    "email": "info@sunstonepartners.com",
    "url": "https://github.com/Sunstone-Partners"
  },
  "repository": "https://github.com/Sunstone-Partners/ensemble",
  "license": "MIT",
  "keywords": [
    "git",
    "workflow",
    "commits",
    "ensemble"
  ],
  "commands": "./commands",
  "skills": "./skills",
  "agents": [
    "./agents/git-workflow.md",
    "./agents/github-specialist.md"
  ]
}
