{
  "name": "ensemble-xunit",
  "version": "6.0.0",
  "description": "xUnit testing framework integration for .NET",
  "author": {
    "name": "Sunstone Partners",
    "email": "info@sunstonepartners.com",
    "url": "https://github.com/Sunstone-Partners"
  },
  "repository": "https://github.com/Sunstone-Partners/ensemble",
  "license": "MIT",
  "keywords": [
    "xunit",
    "testing",
    "dotnet",
    "ensemble"
  ],
  "commands": "./commands",
  "skills": "./skills"
}
