{
  "name": "ensemble-infrastructure",
  "version": "5.3.0",
  "description": "Infrastructure management for AWS, Kubernetes, Docker, Helm, Fly.io",
  "author": {
    "name": "Sunstone Partners",
    "email": "info@sunstonepartners.com",
    "url": "https://github.com/Sunstone-Partners"
  },
  "repository": "https://github.com/Sunstone-Partners/ensemble",
  "license": "MIT",
  "keywords": [
    "infrastructure",
    "devops",
    "kubernetes",
    "aws",
    "ensemble"
  ],
  "dependencies": ["ensemble-core"],
  "commands": "./commands",
  "skills": "./skills",
  "agents": [
    "./agents/build-orchestrator.md",
    "./agents/deployment-orchestrator.md",
    "./agents/helm-chart-specialist.md",
    "./agents/infrastructure-developer.md",
    "./agents/infrastructure-orchestrator.md",
    "./agents/postgresql-specialist.md"
  ]
}
