{
  "name": "ensemble-reqnroll",
  "version": "1.0.2",
  "description": "Reqnroll + xUnit BDD bindings: fill PRD-generated step definitions test-first",
  "author": {
    "name": "Sunstone Partners",
    "email": "info@sunstonepartners.com",
    "url": "https://github.com/Sunstone-Partners"
  },
  "repository": "https://github.com/Sunstone-Partners/ensemble",
  "license": "MIT",
  "keywords": [
    "reqnroll",
    "bdd",
    "gherkin",
    "xunit",
    "dotnet",
    "testing",
    "ensemble"
  ],
  "commands": "./commands",
  "skills": "./skills",
  "agents": [
    "./agents/reqnroll-binding-specialist.md"
  ]
}
