{
  "name": "ensemble-opencode",
  "version": "5.3.1",
  "description": "OpenCode runtime support - translates ensemble artifacts to OpenCode-compatible formats",
  "author": {
    "name": "Sunstone Partners",
    "email": "info@sunstonepartners.com",
    "url": "https://github.com/Sunstone-Partners"
  },
  "repository": "https://github.com/Sunstone-Partners/ensemble",
  "license": "MIT",
  "keywords": [
    "opencode",
    "ensemble",
    "plugin",
    "translation"
  ]
}
