{
  "name": "ensemble-dotnet",
  "version": "1.1.0",
  "description": ".NET backend development agents and skills (ASP.NET Core, Wolverine, MartenDB, CQRS/Event Sourcing)",
  "author": {
    "name": "Sunstone Partners",
    "email": "info@sunstonepartners.com",
    "url": "https://github.com/Sunstone-Partners"
  },
  "repository": "https://github.com/Sunstone-Partners/ensemble",
  "license": "MIT",
  "keywords": [
    "dotnet",
    "aspnetcore",
    "csharp",
    "backend",
    "ensemble"
  ],
  "agents": ["./agents/dotnet-backend-expert.md"],
  "skills": "./skills"
}
