{
  "name": "ensemble-development",
  "version": "7.0.0",
  "description": "Development agents for frontend/backend implementation",
  "author": {
    "name": "Sunstone Partners",
    "email": "info@sunstonepartners.com",
    "url": "https://github.com/Sunstone-Partners"
  },
  "repository": "https://github.com/Sunstone-Partners/ensemble",
  "license": "MIT",
  "keywords": [
    "development",
    "implementation",
    "coding",
    "ensemble"
  ],
  "commands": "./commands",
  "skills": "./skills",
  "agents": [
    "./agents/api-documentation-specialist.md",
    "./agents/beads-build-wave.md",
    "./agents/beads-scaffold-specialist.md",
    "./agents/backend-developer.md",
    "./agents/documentation-specialist.md",
    "./agents/frontend-developer.md",
    "./agents/tech-lead-orchestrator.md"
  ]
}
