{
  "name": "ensemble-jest",
  "version": "6.0.0",
  "description": "Jest testing framework integration",
  "author": {
    "name": "Sunstone Partners",
    "email": "info@sunstonepartners.com",
    "url": "https://github.com/Sunstone-Partners"
  },
  "repository": "https://github.com/Sunstone-Partners/ensemble",
  "license": "MIT",
  "keywords": [
    "jest",
    "testing",
    "javascript",
    "ensemble"
  ],
  "commands": "./commands",
  "skills": "./skills"
}
