{
  "name": "ensemble-product",
  "version": "6.0.0",
  "description": "Product management agents and workflows (PRD creation, analysis)",
  "author": {
    "name": "Sunstone Partners",
    "email": "info@sunstonepartners.com",
    "url": "https://github.com/Sunstone-Partners"
  },
  "repository": "https://github.com/Sunstone-Partners/ensemble",
  "license": "MIT",
  "keywords": [
    "product",
    "prd",
    "planning",
    "ensemble"
  ],
  "commands": "./commands",
  "skills": "./skills",
  "agents": [
    "./agents/product-management-orchestrator.md"
  ]
}
