{
  "name": "ensemble-blazor",
  "version": "5.1.0",
  "description": "Blazor frontend skills: Server and WebAssembly components, Razor, Fluent UI",
  "author": {
    "name": "Sunstone Partners",
    "email": "info@sunstonepartners.com",
    "url": "https://github.com/Sunstone-Partners"
  },
  "repository": "https://github.com/Sunstone-Partners/ensemble",
  "license": "MIT",
  "keywords": [
    "blazor",
    "dotnet",
    "frontend",
    "ensemble"
  ],
  "commands": "./commands",
  "skills": "./skills"
}
