{
  "name": "ensemble-router",
  "version": "5.2.3",
  "description": "UserPromptSubmit routing hook for intelligent agent delegation and skill invocation",
  "author": {
    "name": "Sunstone Partners",
    "email": "info@sunstonepartners.com",
    "url": "https://github.com/Sunstone-Partners"
  },
  "repository": "https://github.com/Sunstone-Partners/ensemble",
  "license": "MIT",
  "keywords": [
    "router",
    "hooks",
    "delegation",
    "orchestration",
    "agent-routing",
    "ensemble"
  ],
  "commands": "./commands"
}
