{
  "name": "ensemble-pytest",
  "version": "6.0.0",
  "description": "Pytest testing framework integration - Execute and generate Python tests with fixtures, parametrization, and mocking support",
  "author": {
    "name": "Sunstone Partners",
    "email": "info@sunstonepartners.com",
    "url": "https://github.com/Sunstone-Partners"
  },
  "repository": "https://github.com/Sunstone-Partners/ensemble",
  "license": "MIT",
  "keywords": [
    "pytest",
    "testing",
    "python",
    "ensemble",
    "fixtures",
    "mocking",
    "parametrization",
    "test-generation"
  ],
  "commands": "./commands",
  "skills": "./skills"
}
