{
  "name": "ensemble-pi-extension",
  "version": "0.1.1",
  "description": "Thin Pi-specific extension: native command completion for prd/trd/issue/feature dispatchers via Pi's extension mechanism (npm library, no Claude Code skills/agents/commands)",
  "author": {
    "name": "Sunstone Partners",
    "email": "info@sunstonepartners.com",
    "url": "https://github.com/Sunstone-Partners"
  },
  "repository": "https://github.com/Sunstone-Partners/ensemble",
  "license": "MIT",
  "keywords": [
    "ensemble",
    "pi-extension"
  ]
}
