{
  "name": "ensemble-nestjs",
  "version": "5.1.1",
  "description": "NestJS backend framework skills for Claude Code AI-Augmented Development",
  "author": {
    "name": "Sunstone Partners",
    "email": "info@sunstonepartners.com",
    "url": "https://github.com/Sunstone-Partners"
  },
  "repository": "https://github.com/Sunstone-Partners/ensemble",
  "license": "MIT",
  "keywords": [
    "nestjs",
    "backend",
    "nodejs",
    "typescript",
    "ensemble",
    "framework"
  ],
  "commands": "./commands",
  "skills": "./skills"
}
