{
  "name": "ensemble-core",
  "version": "6.0.0",
  "description": "Core orchestration and utilities for ensemble ecosystem",
  "author": {
    "name": "Sunstone Partners",
    "email": "info@sunstonepartners.com",
    "url": "https://github.com/Sunstone-Partners"
  },
  "repository": "https://github.com/Sunstone-Partners/ensemble",
  "license": "MIT",
  "keywords": [
    "orchestration",
    "core",
    "ensemble",
    "framework-detection"
  ],
  "commands": "./commands",
  "skills": "./skills",
  "agents": [
    "./agents/agent-meta-engineer.md",
    "./agents/context-fetcher.md",
    "./agents/directory-monitor.md",
    "./agents/ensemble-orchestrator.md",
    "./agents/file-creator.md",
    "./agents/general-purpose.md"
  ]
}
