{
  "name": "ensemble-e2e-testing",
  "version": "6.0.0",
  "description": "End-to-end testing with Playwright integration",
  "author": {
    "name": "Sunstone Partners",
    "email": "info@sunstonepartners.com",
    "url": "https://github.com/Sunstone-Partners"
  },
  "repository": "https://github.com/Sunstone-Partners/ensemble",
  "license": "MIT",
  "keywords": [
    "e2e",
    "playwright",
    "testing",
    "ensemble"
  ],
  "commands": "./commands",
  "skills": "./skills",
  "agents": [
    "./agents/playwright-tester.md"
  ]
}
