{
  "name": "ensemble-react",
  "version": "6.0.0",
  "description": "React framework skills and component development for Claude Code",
  "author": {
    "name": "Sunstone Partners",
    "email": "info@sunstonepartners.com",
    "url": "https://github.com/Sunstone-Partners"
  },
  "repository": "https://github.com/Sunstone-Partners/ensemble",
  "license": "MIT",
  "keywords": [
    "react",
    "frontend",
    "components",
    "hooks",
    "typescript",
    "state-management",
    "ensemble"
  ],
  "commands": "./commands",
  "skills": "./skills"
}
