{
  "name": "ensemble-quality",
  "version": "5.4.0",
  "description": "Quality assurance, code review, and DoD enforcement",
  "author": {
    "name": "Sunstone Partners",
    "email": "info@sunstonepartners.com",
    "url": "https://github.com/Sunstone-Partners"
  },
  "repository": "https://github.com/Sunstone-Partners/ensemble",
  "license": "MIT",
  "keywords": [
    "quality",
    "review",
    "testing",
    "ensemble"
  ],
  "dependencies": ["ensemble-core"],
  "commands": "./commands",
  "skills": "./skills",
  "agents": [
    "./agents/code-reviewer.md",
    "./agents/deep-debugger.md",
    "./agents/qa-orchestrator.md",
    "./agents/test-reader-agent.md",
    "./agents/test-runner.md"
  ]
}
